{
  "helper_schema_version": 1,
  "source": "win-uia-helper",
  "command": "capture-frontmost",
  "timestamp": "2026-04-25T13:10:00+08:00",
  "window": {
    "hwnd": "0x0000000000BAD002",
    "pid": 6801,
    "process_name": "example-login.exe",
    "exe_path": "C:\\Program Files\\ExampleLogin\\example-login.exe",
    "app_name": "Example Login",
    "title": "Example Login",
    "bounds": [320, 240, 900, 700],
    "elevated": false
  },
  "focused_element": {
    "control_type": "Edit",
    "name": "Password",
    "automation_id": "password",
    "class_name": "PasswordBox",
    "is_editable": true,
    "is_password": true,
    "value": "[REDACTED:password_field]",
    "text": "[REDACTED:password_field]"
  },
  "visible_text": "Example Login\nEmail\nPassword\nSign in",
  "url": null,
  "uia_tree": {
    "role": "Window",
    "name": "Example Login",
    "children": [
      {
        "role": "Edit",
        "name": "Password",
        "is_password": true
      }
    ]
  },
  "limits": {
    "depth": 80,
    "max_nodes": 5000,
    "max_text_chars": 20000,
    "node_count": 2
  },
  "uia_stats": {
    "nodes_visited": 2,
    "nodes_skipped": 0,
    "stale_nodes_skipped": 0,
    "exceptions_skipped": 0,
    "chars_collected": 38,
    "elapsed_ms": 14,
    "max_depth_observed": 1,
    "time_budget_ms": 3000,
    "time_budget_exceeded": false,
    "max_nodes_reached": false,
    "max_depth_reached": false,
    "max_chars_reached": false
  },
  "capture_target": {
    "kind": "frontmost",
    "hwnd": "0x0000000000BAD002",
    "requested_pid": null,
    "resolved_pid": 6801,
    "frontmost_at_capture": true,
    "harness_only": false
  },
  "truncated": false,
  "capture_surfaces": {
    "screenshots": false,
    "ocr": false,
    "audio": false,
    "keyboard": false,
    "clipboard": false,
    "desktop_control": false
  }
}
